{
  "$schema": "https://json-schema.org/draft/2020-12/schema",
  "$id": "urn:project-gateway:schema:lifecycle:1.0:records:runtime-grant",
  "title": "RuntimeGrant",
  "type": "object",
  "required": [
    "record_type",
    "record_id",
    "created_at",
    "responsible_role",
    "registry_snapshot_reference",
    "bundle",
    "workspace_id",
    "reserved_occurrence_id",
    "attempt_limit",
    "validity",
    "narrowed_constraints"
  ],
  "properties": {
    "record_type": {
      "const": "RuntimeGrant"
    },
    "record_id": {
      "$ref": "urn:project-gateway:schema:artifact:1.0:common:identifiers#/$defs/lifecycleRecordId"
    },
    "created_at": {
      "$ref": "urn:project-gateway:schema:artifact:1.0:common:identifiers#/$defs/timestamp"
    },
    "responsible_role": {
      "const": "trusted-runtime-grant-authority"
    },
    "registry_snapshot_reference": {
      "$ref": "urn:project-gateway:schema:registry:1.0:registry-snapshot-reference"
    },
    "bundle": {
      "allOf": [
        {
          "$ref": "urn:project-gateway:schema:artifact:1.0:common:exact-artifact-reference"
        },
        {
          "properties": {
            "target_kind": {
              "properties": {
                "id": {
                  "const": "ExecutionBundle"
                }
              }
            }
          }
        }
      ]
    },
    "workspace_id": {
      "$ref": "urn:project-gateway:schema:artifact:1.0:common:identifiers#/$defs/workspaceId"
    },
    "reserved_occurrence_id": {
      "$ref": "urn:project-gateway:schema:artifact:1.0:common:identifiers#/$defs/occurrenceId"
    },
    "attempt_limit": {
      "type": "integer",
      "minimum": 1,
      "maximum": 64
    },
    "validity": {
      "$ref": "urn:project-gateway:schema:lifecycle:1.0:common:components#/$defs/validityBound"
    },
    "narrowed_constraints": {
      "type": "array",
      "maxItems": 16,
      "items": {
        "oneOf": [
          {
            "type": "object",
            "required": [
              "type",
              "value"
            ],
            "properties": {
              "type": {
                "const": "max-actions"
              },
              "value": {
                "type": "integer",
                "minimum": 0,
                "maximum": 9007199254740991
              }
            },
            "unevaluatedProperties": false
          },
          {
            "type": "object",
            "required": [
              "type",
              "value"
            ],
            "properties": {
              "type": {
                "const": "max-resources"
              },
              "value": {
                "type": "integer",
                "minimum": 0,
                "maximum": 9007199254740991
              }
            },
            "unevaluatedProperties": false
          },
          {
            "type": "object",
            "required": [
              "type",
              "value"
            ],
            "properties": {
              "type": {
                "const": "read-only"
              },
              "value": {
                "const": true
              }
            },
            "unevaluatedProperties": false
          },
          {
            "type": "object",
            "required": [
              "type",
              "value"
            ],
            "properties": {
              "type": {
                "const": "require-exact-resource"
              },
              "value": {
                "const": true
              }
            },
            "unevaluatedProperties": false
          }
        ]
      }
    }
  },
  "unevaluatedProperties": false
}
